ID,English,Chinese_Simplified,French,German,Italian,Polish,Portuguese_Brazil,Russian,Spanish
Mission_Train_Failure_CEO_Sand_1,That was one of the last maglevs we had. I'll report the loss to the destination city and see what I can do for the relief efforts there.,,C'était l'un de nos derniers trains à sustentation magnétique. Je vais dire à la ville de destination que nous l'avons perdu et nous verrons ce que nous pouvons faire pour eux.,"Das war eine unserer letzten Magnetschwebebahnen. Ich werde den Verlust der Stadt am Zielort melden und sehen, was ich tun kann, um Hilfe zu leisten.",That was one of the last maglevs we had. I'll report the loss to the destination city and see what I can do for the relief efforts there.,"To był jeden z ostatnich pociągów magnetycznych, jakie mieliśmy. Zgłoszę stratę miastu docelowemu i zobaczymy, czy możemy coś dla niego zrobić bez tych zapasów.",Aquele era um dos nossos últimos maglevs. Vou comunicar a perda à cidade de destino e ver o que podemos fazer para aliviar a situação deles.,"Это был один из последних уцелевших составов. Придется сообщить в точку назначения, что грузы не прибудут, и постараться помочь им как-то иначе.",Ese era uno de los últimos trenes de levitación magnética que nos quedaban. Informaré de su pérdida a la ciudad de destino y veré qué puedo hacer para compensarla.
Mission_Train_Failure_CEO_Sand_2,"Every maglev we lose, we lose two cities. Protecting my people means protecting the supply lines.",,"À chaque train à sustentation magnétique perdu, nous perdons également deux villes. Protéger les miens signifie défendre nos lignes d'approvisionnement.","Mit jeder Magnetschwebebahn, die wir verlieren, verlieren wir zwei Städte. Meine Leute zu beschützen, heißt, die Nachschublinien zu beschützen.","Every maglev we lose, we lose two cities. Protecting my people means protecting the supply lines.",Każdy stracony pociąg magnetyczny to utrata dwóch miast. Ochranianie moich ludzi wymaga ochrony linii zaopatrzeniowych.,"Para cada maglev perdido, perdemos duas cidades. Proteger meu povo significa proteger as linhas de abastecimento.","Каждый уничтоженный состав — это два потерянных города. Чтобы защитить людей, мы должны защитить транспортные линии.","Cada vez que perdemos un tren de levitación magnética, perdemos dos ciudades. Proteger a mi gente implica proteger las líneas de suministro."
Mission_Train_Failure_CEO_Acid_1,The train is destroyed - and the byproducts it was carrying have contaminated the sector. It's uninhabitable to all but the Vek.,,"Le train a été détruit et les substances chimiques qu'il transportait ont contaminé le secteur. Il est totalement inhabitable, désormais... sauf pour les Veks.","Der Zug wurde zerstört und die Abfallprodukte, die er transportiert hat, haben den Sektor kontaminiert. Er ist für alle, außer die Vek, unbewohnbar.",The train is destroyed - and the byproducts it was carrying have contaminated the sector. It's uninhabitable to all but the Vek.,"Pociąg został zniszczony, a uboczne produkty utylizacji, jakie przewoził, zatruły sektor. Teraz mogą w nim żyć tylko veki.",O trem foi destruído junto com os subprodutos que ele carregava contaminaram o setor. Está inabitável para todos exceto os Vek.,"Поезд уничтожен, отходы разлились по всему сектору. Теперь здесь смогут выжить только векки.","El tren ha sido destruido... y los subproductos que transportaba han contaminado el sector. Ahora, solo los vek pueden vivir allí."
Mission_Train_Failure_CEO_Acid_2,"There's nothing left of the train. Or its crew. Detritus honors their bravery, and mourns their loss.",,"Il ne reste plus rien du train, ni de l'équipage. DétriTue leur rendra honneur. C'est une perte terrible pour nous tous.",Vom Zug ist fast nichts übrig. Von der Besatzung auch nicht. Detritus ehrt ihren Mut und trauert um ihren Verlust.,"There's nothing left of the train. Or its crew. Detritus honors their bravery, and mourns their loss.",Z pociągu nic nie zostało i nikt z załogi nie przeżył. Detritus oddaje hołd ich odwadze i opłakuje ich stratę.,Não restou nada do trem. Ou da tripulação. A Detritus honra a bravura e lamenta a perda deles.,От поезда ничего не осталось. Как и от поездной бригады. Весь «Детритус» скорбит об этой утрате.,No queda nada del tren. Ni de su tripulación. Detritus honra su valor y llora su pérdida.
Mission_Train_Partial_CEO_Grass_1,"It'll take weeks to fix that train, but at least it's not a total loss. For now, we'll have to find an alternate way to ship supplies.",,"Il faudra plusieurs semaines pour réparer le train, mais au moins, nous n'avons pas tout perdu. Sauf qu'en attendant, il va nous falloir trouver un autre moyen d'acheminer des provisions.","Es wird Wochen dauern, den Zug zu reparieren, aber zumindest ist er nicht ganz verloren. Wir brauchen eine Alternative, um Nachschub zu transportieren.","열차를 고치는데 몇 주 정도 걸리겠지만, 완전히 부셔진 것은 아니니까요. 그래도 지금은 보급품을 나를 다른 방법을 찾아야 겠습니다. ","Naprawa pociągu zajmie tygodnie, ale przynajmniej nie straciliśmy go na zawsze. Tymczasem musimy znaleźć alternatywny sposób transportu zaopatrzenia.","Levará semanas para consertar aquele trem, mas pelo menos não perdemos tudo. Vamos encontrar outra maneira de enviar suprimentos por enquanto.","На ремонт поезда уйдут недели, но, по крайней мере, его удалось сохранить. Хотя, конечно, придется пока искать другой способ доставки снабжения.","Tardaremos semanas en arreglar el tren, pero no lo hemos perdido. Por el momento, tendremos que buscar una alternativa para transportar los suministros."
Mission_Train_Partial_CEO_Grass_2,"These Old Earth trains were built to last! Despite the knocking it took, we can still get it back up and running - remarkable!",,Ces trains de la Terre d'antan sont vraiment solides ! Vous vous rendez compte qu'il roule encore malgré les dégâts qu'il a subis ? C'est remarquable !,Die Züge der Alten Welt wurden für die Ewigkeit gebaut! Trotz des Schadens können wir ihn wieder zum Laufen bringen ... beeindruckend!,"이 구 지구 열차들은 정말 튼튼하네요! 몇 대 얻어 맞았지만, 다시 시동을 걸고 굴릴수 있습니다 - 놀랍네요!","Te pociągi Dawnej Ziemi są niezwykle wytrzymałe! Dostał niezłe baty, a wciąż może być na chodzie! Niesamowite!","Esses trens da Terra Antiga foram feitos para durar! Ainda podemos recuperá-lo, mesmo com as pancadas que sofreu. Extraordinário!","Старая Земля строила на совесть! Поезду крепко досталось, но его все же удастся снова вернуть в строй. Просто невероятно!","¡Los trenes de la Vieja Tierra estaban hechos para durar! Le han dado lo suyo, pero podremos volver a ponerlo en marcha. ¡Es increíble!"
Mission_Train_Partial_CEO_Grass_3,It'll take more than the Vek to stop ol' 'Horace'. We'll have him back on his feet in no time!,,Il faudrait bien plus que quelques Veks pour arrêter notre vieille Rosie. Elle sera de nouveau en état de marche en un rien de temps !,"Es braucht schon mehr als die Vek, um den Alten Horaz zu stoppen. Wir werden ihn schnell wieder flottkriegen!",호러스 영감'을 멈추는데에는 Vek보다 더 센 것이 필요하네요. 머지않아 제 발로 다시 달릴 수 있을 것입니다.,Kilka veków nie powstrzyma starego Horacego. W mig go naprawimy!,"Será preciso mais do que os Vek para parar o velho ""Horace"". Vamos fazê-lo voltar à ativa num piscar de olhos!","Одних векков недостаточно, чтобы остановить старика «Горация». Скоро мы его снова поставим на ноги!",Hará falta algo más que los vek para detener al bueno de Horacio. ¡Muy pronto volverá a correr como el viento!
Mission_Train_Partial_CEO_Sand_1,"Why was the train's path interrupted? It could have been destroyed... my engineers say it's recoverable, but we can't afford to have it idle for repairs.",,"Pourquoi le train a-t-il été arrêté ? Il aurait pu être détruit ! Mes ingénieurs disent qu'il est réparable, mais nous ne pouvons pas nous permettre de le laisser au hangar.","Warum hat der Zug angehalten? Er hätte zerstört werden können ... Meine Techs meinen, sie können ihn reparieren, aber einen Stillstand können wir uns nicht leisten.","Why was the train's path interrupted? It could have been destroyed... my engineers say it's recoverable, but we can't afford to have it idle for repairs.","Dlaczego pociąg napotkał na przeszkody? Mógł zostać zniszczony... Inżynierowie mówią, że da się go naprawić, ale nie możemy sobie pozwolić, aby stał bezczynnie.","Por que a linha do trem foi interrompida? Ele poderia ter sido destruído... meus engenheiros dizem que tem conserto, mas ele não pode ficar parado para manutenção.","Куда вы смотрели? Мы чуть не потеряли поезд! Инженеры говорят, что повреждения можно исправить, но пока идет ремонт, толка от него будет мало.","¿Cómo se interrumpió el trayecto del tren? Podían haberlo destruido... Los mecánicos dicen que podremos recuperarlo, pero no podemos permitirnos que esté parado por reparaciones."
Mission_Train_Partial_CEO_Sand_2,We're dispatching teams to the train now - their priority is to get it running.,,Nous allons envoyer des équipes au train sans plus attendre. Leur priorité est de le remettre en marche dans les plus brefs délais.,Wir entsenden gerade Teams zum Zug ... sie müssen ihn zum Laufen bringen.,We're dispatching teams to the train now - their priority is to get it running.,Wysyłamy zespoły naprawcze do pociągu. Musimy go uruchomić za wszelką cenę.,Já estamos encaminhando equipes para o trem. A prioridade delas é consertá-lo.,Мы срочно высылаем техников к составу. Их основная задача — снова вернуть его в строй.,Acabamos de enviar equipos al tren. Su prioridad es ponerlo en marcha.
Mission_Train_Partial_CEO_Acid_1,"The train was damaged, but the #squad saved the crew. You have our gratitude, commander.",,"Le train a été endommagé, mais les #squad ont réussi à sauver l'équipage. Merci, commandant.","Der Zug wurde beschädigt, aber die #squad haben die Besatzung gerettet. Wir danken Ihnen, Commander.","The train was damaged, but the #squad saved the crew. You have our gratitude, commander.","Pociąg został uszkodzony, ale #squad uratowali załogę. Dziękujemy wam, dowódco.","O trem sofreu danos, mas o esquadrão #squad salvou a tripulação. Somos gratos, comandante.","Поезд поврежден, но #squad успели спасти бригаду. Выражаю вам свою благодарность, командир.","El tren sufrió daños, pero los #squad salvaron a la tripulación. Te lo agradecemos, comandante."
Mission_Train_Partial_CEO_Acid_2,"The train was damaged, but not beyond repair - thanks to you, our engineers can get it up and running again.",,"Le train a été endommagé, mais il est réparable. Grâce à vous, nos ingénieurs vont pouvoir le remettre en état.","Der Zug wurde beschädigt, aber er lässt sich reparieren. Dank Ihnen können unsere Techs ihn wieder zum Laufen bringen.","The train was damaged, but not beyond repair - thanks to you, our engineers can get it up and running again.","Pociąg został uszkodzony, ale da się go naprawić. Dzięki tobie nasi inżynierowie będą mogli go ponownie uruchomić.","O trem sofreu danos, mas não irreversíveis. Graças a você, nossos engenheiros podem recuperar seu funcionamento.","Поезд получил повреждения, но его еще можно восстановить. Благодаря вам, у наших инженеров есть шанс вернуть его в строй.","El tren sufrió daños, pero nada irreparable. Gracias a vosotros, nuestros mecánicos podrán volver a ponerlo en marcha."
Mission_Volatile_Briefing_CEO_Grass_1,"These 'volatile' Vek don't have the courtesy to simply die - they explode and damage entire regions. Drive it away, but whatever you do, don't kill it!",,"Ces Veks Volatils ne se contentent pas de mourir, ils le font en explosant, ce qui dévaste les environs ! Chassez celui-ci, mais surtout, ne le tuez pas !","Diese Spreng-Vek sterben leider nicht einfach so ... sie explodieren und beschädigen dabei ganze Regionen. Verjagen Sie den Vek, aber töten Sie ihn nicht!","이 '폭발성' Vek은 단순히 죽는 예의가 없습니다 - 폭발해서 모든 것들을 날려버려요. 쫓아내세요, 어떻게든, 죽이지 마세요! ","Te wybuchowe veki nie ograniczają się do śmierci. Gdy umierają, wybuchają i niszczą całą okolicę. Przepędź go, ale nie zabijaj - nie ważne, co by się działo!","Esses Vek ""voláteis"" não nos fazem o favor de simplesmente morrer: eles explodem e arrasam regiões inteiras. Livre-se deles, seja como for, mas não os mate!","Эти «гремучие» векки не могут спокойно сдохнуть — они взрываются, нанося ущерб всему региону. Делайте что хотите, только не убивайте его!","Estos vek ""volátiles"" no tienen la cortesía de morirse sin más, sino que explotan y causan daños a regiones enteras. ¡Espantadlo, pero no lo matéis bajo ningún concepto!"
Mission_Volatile_Briefing_CEO_Grass_2,"These 'volatile' Vek detonate on death! Drive it away and for safety's sake, don't let it explode!",,"Ces Veks Volatils explosent quand ils meurent ! Repoussez celui-ci, mais surtout, attention à ce qu'il n'explose pas !","Dieser Vek explodiert, wenn er stirbt! Verjagen Sie ihn nur, er darf auf keinen Fall explodieren!",이 '폭발성' Vek은 죽을 때 폭발합니다. 안전을 위해서 쫓아만 내세요. 폭발하게 두지 마세요! ,"Te wybuchowe veki eksplodują w momencie śmierci! Odpędź go i nie pozwól, aby wybuchł!","Esses Vek ""voláteis"" explodem ao morrer! Afaste-os e, pela nossa segurança, não deixe que explodam!","Такие «гремучие» векки при смерти взрываются! Гоните его подальше и, ради всего святого, не позволяйте ему взорваться!","¡Estos vek ""volátiles"" explotan al morir! Espantadlo y, por el bien de todos, ¡no lo hagáis detonar!"
Mission_Volatile_Briefing_CEO_Sand_1,"Normally I wouldn't ask you to hold your fire - but one of the Vek is a Volatile, it'll explode if you kill it. Drive it off instead.",,"En temps normal, je ne vous dirais jamais de ne pas tirer, mais un des Veks est un Volatil, et si vous le tuez, il explosera. Faites plutôt en sorte de le repousser.","Eigentlich würde ich Sie nicht bitten, das Feuer einzustellen, aber einer der Vek ist explosiv. Er explodiert, wenn Sie ihn töten. Verjagen Sie ihn nur.","Normally I wouldn't ask you to hold your fire - but one of the Vek is a Volatile, it'll explode if you kill it. Drive it off instead.","Zwykle nie proszę o wstrzymanie ognia w walce z vekami, ale ten tutaj wybucha po śmierci. Przepędź go zamiast zabijać.","Normalmente eu não lhe pediria para cessar fogo, mas um dos Vek é um Volátil e explodirá se morrer. É melhor só expulsá-lo.","В обычной ситуации мне и в голову бы не пришло просить вас быть сдержаннее, но «гремучий» векк взорвется, если его убить. Просто гоните его подальше.","Por lo general, no os pediría que no disparaseis, pero... uno de los vek es volátil y explotará si lo matáis. Mejor espantadlo."
Mission_Volatile_Briefing_CEO_Sand_2,"A Volatile Vek has been spotted. When they die, they explode and kick up a mile of dust that scrambles our sensors for days - don't kill it, drive it away instead.",,"Un Vek Volatil a été repéré. Quand ils meurent, ces saletés explosent, ce qui soulève une tonne en poussière, et après, il nous faut plusieurs jours pour nettoyer nos capteurs ! Chassez-le sans le tuer.","Es wurde ein Spreng-Vek gesichtet. Wenn diese Vek sterben, explodieren sie und wirbeln eine riesige Staubwolke auf, die unsere Sensoren tagelang stört. Töten Sie ihn nicht, verjagen Sie ihn nur.","A Volatile Vek has been spotted. When they die, they explode and kick up a mile of dust that scrambles our sensors for days - don't kill it, drive it away instead.","Dostrzegliśmy Wybuchowego Veka. Gdy takie veki umierają, wybuchają i wyrzucają w niebo pył na kilometr. Pył zakłóca nasze czujniki, więc przepędźcie go zamiast zabijać.","Um Vek Volátil foi avistado. Eles explodem quando morrem, levantando poeira por quilômetros e causando interferência em nossos sensores por dias. Afaste-o sem matá-lo.","В секторе замечен «гремучий векк». Такие в момент смерти взрываются, вздымая облака пыли — наши сенсоры потом пару дней ничего не видят. Не убивайте его, просто отгоните.","Han visto a un vek volátil. Cuando mueren, explotan y levantan una inmensa nube de polvo que nos bloquea los sensores durante días. No lo matéis. Mejor espantadlo."
Mission_Volatile_Briefing_CEO_Sand_3,"These Vek are nasty ones. Volatile Vek don't die quietly, they detonate... and take entire districts with them. Do not kill it - make it run.",,"Ces Veks Volatils sont vraiment des saletés. Au lieu de mourir calmement, ils explosent, en détruisant des quartiers entiers avec eux. Alors, ne tuez pas celui-ci, faites-le fuir.","Diese Vek sind lästig. Spreng-Vek sterben nicht leise, sie explodieren ... und vernichten ganze Bereiche. Töten Sie ihn nicht, verjagen Sie ihn.","These Vek are nasty ones. Volatile Vek don't die quietly, they detonate... and take entire districts with them. Do not kill it - make it run.","Te veki są okropne. Wybuchowy Vek nie umiera ot tak, tylko wybucha. Eksplozja pochłania całe dzielnice. Nie zabijaj go - spraw, aby uciekł.","Esses Vek são terríveis. Vek Voláteis não morrem discretamente, mas sim explodem... e levam distritos inteiros com eles. Não os mate; faça com que fujam.","«Гремучник» — особенно мерзкий векк. Вместо того, чтоб тихо сдохнуть, он взрывается, забирая с собой целые кварталы. Не трогайте его — пусть лучше сбежит.","Estos vek son lo peor. Los vek volátiles no se mueren y ya, sino que explotan... y se llevan distritos enteros por delante. No lo matéis. Haced que huya."
Mission_Volatile_Briefing_CEO_Sand_4,"These Volatile Vek are living bombs. Don't kill it, drive it away before it turns the region into a crater.",,Ces Veks Volatils sont des bombes vivantes. Évitez de tuer celui-ci. Repoussez-le plutôt avant qu'il ne transforme la région en cratère fumant.,"Dieser Spreng-Vek ist eine lebende Bombe. Töten Sie ihn nicht, sondern verjagen Sie ihn, bevor er die Region in einen Krater verwandelt.","These Volatile Vek are living bombs. Don't kill it, drive it away before it turns the region into a crater.","Te Wybuchowe Veki to chodzące bomby. Nie zabijaj go. Przepędź go, zanim zamieni cały region w krater.","Esses Vek Voláteis são verdadeiras bombas. Não os mate, afaste-os antes que transformem a região em um buraco.","Гремучие векки — просто ходячие бомбы. Не убивайте его; пусть лучше сбежит, чем превратит весь район в большой кратер.",Esos vek volátiles son bombas vivientes. No lo matéis. Espantadlo para que no convierta la región en un cráter.
Mission_Volatile_Briefing_CEO_Snow_1,My Vek Analysis Process has triggered an alert. One of the Vek in this region will detonate on death. You must drive it away without killing it.,,Mon programme d'analyse des Veks vient de m'alerter. Un de ceux que nous affrontons ici explose en mourant. Vous allez devoir le repousser sans le tuer.,"Mein Vek-Analyseprozess hat einen Alarm ausgelöst. Einer der Vek in dieser Region explodiert, wenn er stirbt. Verjagen Sie ihn, töten Sie ihn aber nicht.",My Vek Analysis Process has triggered an alert. One of the Vek in this region will detonate on death. You must drive it away without killing it.,Mój Proces Analizy Veków podniósł alarm. Jeden z veków w tym regionie wybuchnie po śmierci. Musisz go przepędzić zamiast zabijać.,Meu Processo de Análise Vek disparou um alerta. Um dos Vek nessa região explode ao morrer. Você precisa afastá-lo sem matá-lo.,"Аналитический процесс поднял тревогу: в регионе присутствует векк, который взорвется после смерти. Вы должны отогнать его, не убивая.","Mi proceso de análisis de vek ha activado una alerta. Uno de los vek de la región detonará al morir. Tenéis que expulsarlo, pero sin matarlo."
Mission_Volatile_Briefing_CEO_Acid_1,"We have detected a Volatile Vek in this sector, and it is imperative it not... detonate, or it may cause a chain reaction.",,"Nous avons détecté un Vek Volatil dans le secteur. Il est impératif qu'il n'explose pas, car cela pourrait déclencher une réaction en chaîne.","Wir haben einen Spreng-Vek in diesem Sektor erfasst und es ist wichtig, dass er nicht ... explodiert. Sonst löst er eine Kettenreaktion aus.","We have detected a Volatile Vek in this sector, and it is imperative it not... detonate, or it may cause a chain reaction.","Wykryliśmy Wybuchowego Veka w tym sektorze. Głównym priorytetem jest nie dopuścić do jego wybuchu, bo może on wywołać reakcję łańcuchową.","Detectamos um Vek Volátil nesse setor, e é essencial que ele não... exploda, ou isso poderá causar uma reação em cadeia.",В этом секторе замечен гремучий векк. Исключительно важно не дать ему детонировать — это может привести к возникновению цепной реакции.,"Hemos detectado un vek volátil en el sector y es imprescindible que no detone, ya que provocaría una reacción en cadena."
Mission_Volatile_Briefing_CEO_Acid_2,"Intercept the Vek in this sector, but do not harm the Volatile Vek - drive it away without killing it or the damage will be catastrophic.",,"Interceptez les Veks de ce secteur, mais sans faire de mal au Vek Volatil. Chassez-le sans le tuer, sans quoi il explosera, et les dégâts pourraient être terribles.","Halten Sie die Vek in diesem Sektor auf, aber tun Sie dem Spreng-Vek nichts. Verjagen sie ihn, ohne ihn zu töten, der Schaden wäre sonst riesig.","Intercept the Vek in this sector, but do not harm the Volatile Vek - drive it away without killing it or the damage will be catastrophic.","Przechwyć veki w tym sektorze, ale nie krzywdź Wybuchowego Veka. Przepędź go, bo jeśli go zabijesz, zniszczenia mogą być katastrofalne w skutkach.","Intercepte os Vek nesse setor, mas não atinja o Vek Volátil: afaste-o sem matá-lo ou os danos serão catastróficos.","Перехватите врага в этом секторе, но не трогайте гремучего векка. Отгоните его, не убивая, иначе мы рискуем катастрофическими разрушениями.","Interceptad a los vek del sector, pero no dañéis al vek volátil. Espantadlo sin matarlo o causará un daño catastrófico."
Mission_Volatile_Briefing_CEO_Acid_3,"We've identified a Volatile Vek in this sector, commander - 'encourage' it to retreat - without killing it.",,"Nous avons identifié un Vek Volatil dans ce secteur, commandant. Incitez-le à se replier, mais sans le tuer.","Wir haben einen Spreng-Vek in diesem Sektor ausgemacht, Commander. ""Ermutigen"" Sie ihn zum Rückzug, ohne ihn zu töten.","We've identified a Volatile Vek in this sector, commander - 'encourage' it to retreat - without killing it.","Zidentyfikowaliśmy Wybuchowego Veka w tym sektorze, dowódco. Zmuś go do odwrotu bez zadawania mu śmierci.","Identificamos um Vek Volátil nesse setor, comandante. ""Convide-o"" a se retirar... Sem matá-lo.","Командир, в секторе замечен гремучий векк. Уговорите его уйти по-хорошему — не убивая его.","Hemos identificado un vek volátil en el sector, comandante. ""Animadlo"" a que se retire, pero no lo matéis."
