ID,English,Chinese_Simplified,French,German,Italian,Polish,Portuguese_Brazil,Russian,Spanish
Mission_MechHealth_Briefing_CEO_Sand_1,"We can barely keep our cities functioning, let alone repair your Mechs if they are damaged. Choose your shots carefully.",,"Nous avons toutes les peines du monde à garder nos villes en état de marche, alors, réparer vos Mechas... Mieux vaudrait éviter qu'ils se fassent endommager.","Wir können kaum unsere Städte am Laufen halten, geschweige denn kaputte Mechs reparieren. Überlegen Sie gut, worauf sie zielen.","We can barely keep our cities functioning, let alone repair your Mechs if they are damaged. Choose your shots carefully.","Ledwo dajemy radę zagwarantować funkcjonowanie naszych miast, a co dopiero naprawiać twoje uszkodzone mechy. Musicie bardziej uważać.","Mal conseguimos manter nossas cidades em funcionamento, que dirá reparar seus Mekas danificados. Aja com cautela.",Мы едва справляемся с обслуживанием городов — что уж говорить о ремонте поврежденных мехов. Впредь будьте осторожны.,"Apenas podemos mantener nuestras ciudades, como para reparar vuestros mechs si sufren daños. Andaos con pies de plomo."
Mission_MechHealth_Briefing_CEO_Sand_2,This isn't Pinnacle - we don't have enough engineering crews to fix your Mechs if they take heavy damage.,,"Vous n'êtes pas chez Pinacle, ici. Nous n'avons pas assez d'équipes d'ingénieurs pour réparer vos Mechas s'ils venaient à subir des dégâts importants.","Das hier ist nicht Pinnacle ... wir haben nicht genügend Techs, um Ihre Mechs zu reparieren, sollten sie Schaden nehmen.",This isn't Pinnacle - we don't have enough engineering crews to fix your Mechs if they take heavy damage.,"Mylisz naszą korporację z Pinnacle Robotics. Nie mamy tylu inżynierów, aby naprawiać twoje mechy, gdy odnoszą znaczne obrażenia.",Você não está na Pináculo. Não temos engenheiros o suficiente para arrumar seus Mekas caso sofram danos agravados.,"Здесь все же не «Пиннакл» — у нас нет целых бригад инженеров, чтобы ремонтировать ваши мехи после очередных повреждений.",Esto no es Pinnacle. No tenemos mecánicos suficientes para arreglar vuestros mechs si sufren daños graves.
Mission_MechHealth_Briefing_CEO_Snow_1,There will be little time between skirmishes and we need you fully operational. Exercise caution.,,"Les escarmouches s'enchaînent rapidement et nous avons besoin que votre escadron soit pleinement opérationnel, alors, prenez garde.",Es wird nur wenig Zeit zwischen den Gefechten geben und Sie müssen voll einsatzbereit sein. Seien Sie vorsichtig.,There will be little time between skirmishes and we need you fully operational. Exercise caution.,Czas między potyczkami jest krótki. Twój oddział musi być w pełni funkcjonalny. Działajcie ostrożnie.,Haverá pouco tempo entre os conflitos e precisamos de você em funcionamento pleno. Tenha cuidado.,Между операциями не так много времени на восстановление работоспособности. Проявите осторожность.,Habrá poco tiempo entre escaramuzas y tenéis que estar plenamente operativos. Id con cuidado.
Mission_MechHealth_Briefing_CEO_Snow_2,Our robotic repair teams are offline. It will be difficult to assist with Mech repair before the next combat operation. Please keep that in mind.,,"Nos équipes de réparation robotisées sont hors ligne, et nous aurons du mal à vous aider à réparer vos Mechas avant le prochain combat. Gardez bien ce paramètre à l'esprit.","Unsere Roboter-Reparaturteams sind offline. Es wird schwierig sein, Mech-Reparaturen vor dem nächsten Kampf durchzuführen. Denken Sie daran.",Our robotic repair teams are offline. It will be difficult to assist with Mech repair before the next combat operation. Please keep that in mind.,Nasze robozespoły naprawcze są wyłączone. Trudno nam będzie pomóc wam z naprawą mechów przed kolejną misją bojową. Miejcie to na uwadze.,Nossas equipes robóticas de reparo estão desligadas. Será difícil oferecer reparos a seus Mekas antes da próxima operação de combate. Tenha isso em mente.,Автоматизированные команды ремонта не в строю. Учтите это: нам будет непросто помочь вам с ремонтом перед следующей боевой операцией.,Nuestros equipos robóticos de reparación están desconectados y será muy difícil arreglar los mechs antes del próximo combate. Tenedlo en cuenta.
Mission_MechHealth_Briefing_CEO_Acid_1,"Unfortunately, most of our engineering division is occupied. If the Mechs of the #squad take too much damage, we may not be able to repair them.",,"Malheureusement, la plupart de nos ingénieurs sont occupés. Si les Mechas des #squad subissent trop de dégâts, il sera sans doute impossible de les réparer.","Leider sind die meisten aus unserer Technikabteilung beschäftigt. Wenn die #squad und ihre Mechs zu viel Schaden erleiden, können wir sie möglicherweise nicht reparieren.","Unfortunately, most of our engineering division is occupied. If the Mechs of the #squad take too much damage, we may not be able to repair them.","Niestety, większość naszych zespołów inżynieryjnych jest zajęta. Jeżeli #squad otrzymają zbyt wiele uszkodzeń, nie będziemy w stanie naprawić mechów.","Infelizmente, a maior parte da nossa divisão de engenharia está ocupada. Se os Mekas do esquadrão #squad sofrerem muito dano, talvez não consigamos arrumá-los.","К сожалению, наш инженерный отдел весьма занят. Если ваши мехи получат слишком значительные повреждения, то, возможно, мы не сможем восстановить их.","Por desgracia, casi todo nuestro departamento de ingeniería está ocupado. Si los mechs de los #squad sufren demasiados daños, no podremos repararlos."
Mission_MechHealth_Briefing_CEO_Acid_2,"We have no personnel to repair your Mechs if damaged. It is unfortunate, but please, do what you can to keep them out of harm's way.",,"Nous n'avons pas de personnel pour réparer vos Mechas s'ils venaient à se faire endommager. C'est regrettable, je sais, mais faites votre possible pour éviter les dégâts.","Wir haben kein Personal, um Ihre Mechs zu reparieren, wenn sie beschädigt sind. Leider lässt sich das nicht ändern, deshalb sollte ihnen möglichst nichts zustoßen.","We have no personnel to repair your Mechs if damaged. It is unfortunate, but please, do what you can to keep them out of harm's way.","Nie mamy personelu naprawczego do dyspozycji, jeżeli wasze mechy zostaną uszkodzone. Przykro mi o to prosić, ale postarajcie się je oszczędzać.","Não temos profissionais para reparar os danos de seus Mekas. É um infortúnio, mas por favor, faça o possível para não colocá-los em risco.","У нас нет свободных рук, чтобы ремонтировать поврежденные мехи. Так что прошу вас, сделайте все возможное, чтобы они пострадали как можно меньше.",No tenemos personal para reparar vuestros mechs si sufren daños. Os rogamos que los mantengáis fuera de peligro.
Mission_MechHealth_Success_CEO_Grass_1,Your Mechs look almost untouched! That's a relief... it'll allow us to assign our repair crews to reinforce the refugee shelters instead.,,"Vos Mechas ont l'air de ne pas avoir subi le moindre dégât, ou presque ! Excellente nouvelle. Nos équipes de réparation vont pouvoir se concentrer sur les abris à réfugiés.",Ihre Mechs sehen unversehrt aus! Wie gut ... also können unsere Reparaturteams stattdessen die Flüchtlingsunterkünfte verstärken.,메크가 상처 하나 없군요! 다행입니다… 이제 우리 수리팀을 피난민 대피소를 강화하는 데 돌릴 수 있겠군요. ,Twoje mechy wyglądają niemalże jak nietknięte! Co za ulga... Będziemy mogli przypisać nasze ekipy naprawcze do wzmacniania schronień uchodźców.,Seus Mekas estão novos em folha! Que alívio... agora poderemos atribuir nossas equipes de resgate para reforçar os abrigos dos refugiados.,"Ваши мехи почти что нетронуты! Отлично... это значит, что техники смогут заняться укреплением убежищ для беженцев.",¡Vuestros mechs están como nuevos! Qué alivio... Podremos asignar los equipos de reparación a las viviendas de los refugiados.
Mission_MechHealth_Success_CEO_Grass_2,Your Mechs are barely scratched! That'll allow us to assign our repair crews to emergencies in other regions.,,Vos Mechas n'ont pas une égratignure ! Cela va nous permettre d'assigner nos équipes de réparation à divers travaux d'urgence dans les autres régions.,Ihre Mechs haben kaum einen Kratzer abbekommen! Also können wir unsere Reparaturteams zu den Notfällen in anderen Regionen schicken.,메크가 거의 흠집도 나지 않았군요! 덕분에 우리 수리팀을 다른 지역의 긴급 상황에 파견할 수 있게 되었습니다. ,Twoje mechy prawie nie oberwały! Dzięki temu możemy przypisać nasze ekipy naprawcze do pilnych zadań w innych regionach.,Seus Mekas estão sem nenhum arranhão! Isso vai nos permitir atribuir equipes de reparo para emergências em outras regiões.,"На ваших мехах от силы пара царапин! Значит, мы сможем отправить техников заниматься восстановлением других регионов.",¡Vuestros mechs no tienen ni un rasguño! Podremos asignar los equipos de reparación a emergencias en otras regiones.
Mission_MechHealth_Success_CEO_Sand_1,I see you and the #squad weathered the worst of it and survived. Excellent.,,Je vois que les #squad et vous avez réussi à survivre malgré l'adversité. Excellent.,"Wie ich sehe, haben Sie und die #squad das Schlimmste überstanden. Ausgezeichnet!",I see you and the #squad weathered the worst of it and survived. Excellent.,"Widzę, że #squad przeszli przez piekło, ale przetrwali. Doskonale.",Vejo que você e o esquadrão #squad passaram pelo pior e sobreviveram. Ótimo.,"Вижу, #squad достойно вынесли это испытание. Превосходно.",Veo que los #squad y tú habéis capeado el temporal y sobrevivido. Excelente.
Mission_MechHealth_Success_CEO_Sand_2,The repair teams report barely a scratch on your Mechs - efficiently done. We can re-allocate the damage control teams to civilian relief and city protection.,,Nos équipes de réparation m'informent que vos Mechas n'ont pas une égratignure. Beau travail ! Elles vont pouvoir se charger de renforcer les défenses de la ville.,"Die Reparaturteams berichten von wenigen Kratzern an Ihren Mechs – gute Arbeit. Wir können die Teams zur Schadensbekämpfung, zur Unterstützung der Zivilisten und zum Schutz der Stadt einsetzen.",The repair teams report barely a scratch on your Mechs - efficiently done. We can re-allocate the damage control teams to civilian relief and city protection.,"Zespoły naprawcze donoszą, że na twoich mechach jest tylko kilka zadrapań. Gratuluję skuteczności. Możemy dzięki temu skierować te zespoły do pomocy cywilom i ochrony miast.",As equipes de reparo relatam leves arranhões em seus Mekas. Ótimo trabalho! Realocaremos os times de controle de dano para cuidar dos civis e proteger as cidades.,"Техники сообщают, что на мехах едва ли найдется пара царапин. Отличная работа. Мы можем перевести ремонтные команды на работу над гражданскими объектами.",Los equipos de reparación informan de que vuestros mechs están intactos. Muy eficiente. Podremos reasignar los equipos de control de daños a apoyo de civiles y protección de ciudades.
Mission_MechHealth_Success_CEO_Sand_3,Your Mechs took almost no damage. That means we can allocate additional resources and repair crews to help refugee centers elsewhere on R.S.T.,,"Vos Mechas n'ont presque pas subi de dégâts, ce qui signifie que nous allons pouvoir allouer nos ressources à l'aide aux réfugiés, ailleurs sur R.S.T.",Ihre Mechs haben fast keinen Schaden erlitten. Also können wir mehr Ressourcen und Reparaturteams zu den Flüchtlingszentren auf R.S.T. schicken.,Your Mechs took almost no damage. That means we can allocate additional resources and repair crews to help refugee centers elsewhere on R.S.T.,"Twoje mechy prawie nie odniosły uszkodzeń. Oznacza to, że możemy przeznaczyć dodatkowe zasoby i ekipy naprawcze do pomocy centrom uchodźców w innych regionach R.S.T.",Seus Mekas estão quase inteiros. Isso significa que podemos realocar recursos e equipes de reparo adicionais para ajudar refugiados de outras regiões da R.S.T.,"Ваши мехи почти что не получили повреждений. Это значит, что ремонтные команды и ресурсы можно отправить в помощь приютам для беженцев в другом регионе «Р.Ж.А.».","Vuestros mechs apenas han sufrido daños, lo que quiere decir que podremos asignar recursos adicionales y equipos de reparación a los centros de refugiados del resto de R.S.T."
Mission_MechHealth_Success_CEO_Snow_1,Your ability to defeat the Vek with minimal damage to the Mechs is admirable. If only all humans showed such concern for their machine counterparts.,,Votre capacité à vaincre les Veks en subissant très peu de dégâts est admirable. Si seulement tous les humains montraient autant de respect que vous pour les machines...,"Dass es Ihnen gelungen ist, die Vek mit nur minimalen Schäden an den Mechs zu besiegen, ist bewundernswert. Wären doch nur alle Menschen so besorgt um ihre maschinellen Brüder.",Your ability to defeat the Vek with minimal damage to the Mechs is admirable. If only all humans showed such concern for their machine counterparts.,Twoja umiejętność pokonywania veków przy minimalnych uszkodzeniach mechów jest zdumiewająca. Gdyby wszyscy ludzie okazywali tyle uwagi swoim mechanicznym odpowiednikom...,Sua habilidade em derrotar os Vek com danos mínimos a seus Mekas é admirável. Quem dera todos os humanos mostrassem tamanho cuidado com suas máquinas.,"Ваша способность побеждать с минимальными повреждениями мехов достойна восхищения. Жаль, что не все люди заботятся о машинах вокруг себя.",Es admirable cómo habéis derrotado a los vek con daños mínimos en los mechs. Ojalá todos los humanos se preocupasen tanto por sus homólogos mecánicos.
Mission_MechHealth_Success_CEO_Acid_1,"Success - and only minor damage to your Mechs, commander, well within the projections of what Detritus can repair.",,"Vous avez gagné et vos Mechas n'ont presque pas subi de dégâts, commandant. D'après nos projections, DétriTue devrait pouvoir réparer tout ça sans problème.","Sie waren erfolgreich, Commander, und mussten nur geringen Schaden an Ihren Mechs einstecken. Diese Reparaturen kann Detritus leisten.","Success - and only minor damage to your Mechs, commander, well within the projections of what Detritus can repair.","Zwycięstwo! A do tego twoje mechy odniosły jedynie powierzchowne uszkodzenia, dowódco. Detritus się z nimi upora.","Sucesso, e com danos mínimos aos seus Mekas, comandante. Isso está completamente dentro das projeções do que a Detritus pode reparar.",Успех — притом с минимальным ущербом для мехов. Ремонтные работы такого уровня вполне по силам для «Детритуса».,"Todo un éxito y con daños mínimos en los mechs, comandante. La capacidad de reparación de Detritus podrá asumirlos con facilidad."
Mission_MechHealth_Success_CEO_Acid_2,"Your Mechs have taken only minor damage, my engineers are certain they can get the #squad back into the field quickly.",,"Vos Mechas n'ont subi que des dégâts superficiels, et mes ingénieurs m'informent que les #squad devraient bientôt être comme neufs.","Ihre Mechs haben nur geringen Schaden erlitten. Meine Techs gehen davon aus, dass die #squad schnell wieder einsatzbereit sind.","Your Mechs have taken only minor damage, my engineers are certain they can get the #squad back into the field quickly.","Twoje mechy mają tylko powierzchowne uszkodzenia. Moi inżynierowie są pewni, że #squad szybko wrócą do walki.","Seus Mekas receberam danos mínimos, meus engenheiros têm certeza que podem fazer com que o esquadrão #squad volte ao campo rapidinho.","Ваши мехи получили весьма скромные повреждения. Техники уверяют, что #squad смогут вернуться в бой в кратчайшие сроки.",Vuestros mechs apenas han sufrido daños. Mis mecánicos pondrán a los #squad en el campo de batalla muy pronto.
Mission_MechHealth_Failure_CEO_Grass_1,I'm told we'll need to divert three teams of engineers to repair your Mechs. The engineering teams have more than enough on their plates already...,,Je viens d'apprendre que trois équipes d'ingénieurs seraient nécessaires pour réparer vos Mechas. Comme s'ils n'étaient pas déjà assez occupés comme ça...,"Mir wurde gesagt, dass wir drei Techteams brauchen, um Ihre Mechs zu reparieren. Die Techs haben aber schon mehr als genug zu tun ...",메크를 수리하는데 기술자 세 팀 파견이 필요하다고 말했었죠. 기술팀들은 이미 과로사 직전입니다… ,"Poinformowano mnie, że musimy skierować aż trzy zespoły inżynierów do naprawy twoich mechów. Moje ekipy naprawcze mają za dużo pracy, aby to zrobić.",Me informaram que precisaremos dedicar três equipes de engenheiros para o reparo de seus Mekas. Como se elas já não estivessem sobrecarregadas...,"Мне сообщают, что на ремонт ваших мехов придется направить три команды техников. А у них и без того хватает хлопот...",Me dicen que tengo que destinar tres equipos de mecánicos para reparar vuestros mechs y no les faltaba trabajo precisamente...
Mission_MechHealth_Failure_CEO_Sand_1,"Your Mechs are heavily damaged; several teams of engineers have been reassigned to repairing them as we speak, even the teams devoted to civilian defense.",,"Vos Mechas ont été lourdement endommagés, et plusieurs équipes d'ingénieurs ont été envoyées les réparer, même celles qui étaient assignées à la protection des civils.","Ihre Mechs sind schwer beschädigt. Es wurden mehrere Techteams abbestellt, um sie zu reparieren, auch Teams, die eigentlich zur Verteidigung der Zivilisten vorgesehen waren.","Your Mechs are heavily damaged; several teams of engineers have been reassigned to repairing them as we speak, even the teams devoted to civilian defense.","Twoje mechy są ciężko uszkodzone. Kilka zespołów inżynieryjnych jest właśnie przekierowywanych do ich naprawy, nawet zespoły zajmujące się obroną cywilów.","Seus Mekas sofreram graves danos; várias equipes de engenheiros estão sendo realocadas para o reparo deles neste instante, até mesmo as dedicadas à defesa dos civis.","Ваши мехи получили существенные повреждения. На их ремонт брошены несколько команд техников — включая тех, кто должен заниматься укреплением обороны.","Vuestros mechs han sufrido daños graves y, para repararlos, se han reasignado varios equipos de mecánicos, incluso los que estaban dedicados a defensa de civiles."
Mission_MechHealth_Failure_CEO_Sand_2,The damage to your Mechs is extensive - we'll have to call in repair crews from the city centers if we're going to stay in the fight. And we must stay in the fight.,,Vos Mechas ont subi des dégâts importants. Nos ingénieurs travaillant aux défenses de la ville vont devoir revenir pour réparer votre escadron. Nous n'avons pas le choix.,"Ihre Mechs sind schwer beschädigt. Wir müssen Reparaturteams von den Stadtzentren abziehen, wenn wir weiterkämpfen wollen. Wir müssen kampffähig bleiben.",The damage to your Mechs is extensive - we'll have to call in repair crews from the city centers if we're going to stay in the fight. And we must stay in the fight.,"Mechy zostały dotkliwie uszkodzone. Musimy wezwać ekipy naprawcze z miast, jeśli mają dalej walczyć. A one muszą dalej walczyć.",Os danos a seus Mekas foram altos. Vamos precisar chamar as equipes de reparo das cidades se quisermos seguir na luta. E precisamos seguir na luta.,"Повреждения ваших мехов весьма значительны. Придется отозвать ремонтные команды из городов, чтобы мы смогли продолжать борьбу. А мы обязаны ее продолжать.",Los daños de los mechs son abrumadores. Tendremos que recurrir a equipos de reparación de los centros urbanos para seguir luchando. Y hay que seguir luchando.
Mission_MechHealth_Failure_CEO_Sand_3,Your Mechs are so torn up they're ready for the scrapyard. It'll take our repair crews working double shifts to get them back in fighting shape!,,Vos Mechas sont dans un si mauvais état qu'ils sont bons pour la casse. Nos équipes de réparation vont devoir travailler toute la nuit pour les remettre en état.,"Ihre Mechs sind so zerstört, dass sie schrottreif sind. Ich lass unsere Reparaturteams doppelte Schichten arbeiten, damit sie wieder einsatzbereit sind!",Your Mechs are so torn up they're ready for the scrapyard. It'll take our repair crews working double shifts to get them back in fighting shape!,"Twoje mechy są tak podziurawione, że nadają się na złom. Nasze zespoły musiałyby pracować na dwie zmiany, aby przywrócić je do stanu używalności!",Seus Mekas estão tão estragados que poderiam ir direto pro ferro velho. Vou precisar das equipes de reparo em jornada dupla para que voltem à ativa!,"Еще немного, и ваши мехи бы годились только на свалку. Техникам придется работать в две смены, чтобы привести их в приличное состояние!",Vuestros mechs están tan machacados que apenas valen para chatarra. Nuestros equipos de reparación tendrán que doblar los turnos para dejarlos listos para el combate.
Mission_MechHealth_Failure_CEO_Sand_4,We've had to call back engineers from the refugee centers to fix the damage to your '#squad'. Don't let this happen again.,,Nous avons dû aller chercher nos ingénieurs qui construisent les centres pour les réfugiés afin de réparer vos #squad. Que cela ne se reproduise plus.,"Wir mussten Techs aus den Flüchtlingszentren abziehen, um den Schaden an Ihren Mechs zu reparieren. Das darf nicht noch mal passieren.",We've had to call back engineers from the refugee centers to fix the damage to your '#squad'. Don't let this happen again.,"Musieliśmy wezwać inżynierów z centrów z uchodźcami, aby naprawić uszkodzenia. #squad, niech to się więcej nie powtórzy.","Precisamos trazer os engenheiros de volta dos campos de refugiados para consertar os danos ao seu esquadrão ""#squad"". Não deixe que isso se repita.","Нам пришлось отозвать техников из приютов для беженцев, чтобы ваши #squad смогли вернуться в бой. Что вы скажете в свое оправдание?",Hemos tenido que sacar a mecánicos de los centros de refugiados para reparar a los #squad. Que no vuelva a ocurrir.
Mission_MechHealth_Failure_CEO_Snow_1,Do not allow your Mech's reinforced hull lead to complacency. Repairing its exoskeleton is a material-heavy process with considerable cost.,,Ce n'est pas parce que vos Mechas sont blindés que vous pouvez faire n'importe quoi. Réparer un exosquelette coûte très cher et prend énormément de temps.,Der verstärkte Rumpf Ihres Mechs ist kein Grund für Größenwahn. Die Reparatur des Exoskeletts ist kostspielig und erfordert viel Material.,Do not allow your Mech's reinforced hull lead to complacency. Repairing its exoskeleton is a material-heavy process with considerable cost.,Nie daj się zwieść wzmocnionym pancerzom swoich mechów. Naprawa ich egzoszkieletu to kosztowny proces wymagający znaczących zasobów.,O casco reforçado de seus Mekas não pode te deixar negligente. Reparar os exoesqueletos deles exige materiais de custo considerável.,Не позволяйте себе расслабляться за прочными корпусами мехов. Ремонт экзоскелета требует существенного количества недешевых ресурсов.,No os confiéis debido a la estructura reforzada de los mechs. Reparar sus exoesqueletos consume muchísimos materiales y es muy costoso.
