ID,English,Chinese_Simplified,French,German,Italian,Polish,Portuguese_Brazil,Russian,Spanish
Mission_Satellite_Failure_CEO_Grass_1,More artifacts destroyed by the Vek - along with our chance of establishing an early warning system.,,Encore des artefacts détruits par les Veks... ainsi que notre chance de mettre en place un système pour nous prévenir avant les attaques.,Es wurden noch mehr Artefakte durch die Vek zerstört ... und damit unsere Hoffnung auf ein Frühwarnsystem.,"Vek이 유물들을 날렸고, 조기 경보 시스템을 갖출 기회도 날라갔습니다. ",Kolejne eksponaty przepadły w walce z vekami. A wraz z nimi nasza szansa na stworzenie systemu wczesnego ostrzegania.,"Mais artefatos destruídos pelos Vek, junto com nossa chance de estabelecer um sistema de aviso prévio.",Векки снова уничтожили ценные артефакты — а вместе с ними и наш последний шанс соорудить систему раннего оповещения.,Los vek han destruido más artefactos... y nuestras esperanzas de establecer un sistema de alerta temprana.
Mission_Satellite_Failure_CEO_Grass_2,My grandfather recovered those satellites for Archive Inc. - many lives would have been saved if we could've put them back in orbit. It's a tragedy to have lost them both.,,C'est mon grand-père qui a récupéré ces satellites. De nombreuses vies auraient pu être sauvées si nous avions réussi à les mettre en orbite. Quelle tragédie que nous les ayons perdus !,"Mein Großvater hat diese Satelliten für Archive Inc. zurückgeholt. Wir hätten viele Leben retten können, wenn wir sie wieder ins Weltall gebracht hätten. Tragisch, dass wir beide verloren haben.",제 할아버지께서 아카이브를 위해 저 위성들을 복원했습니다. - 궤도로 다시 올린다면 많은 생명을 구할 것이라 믿고요. 하지만 둘 다 잃어 비극이군요. ,"Mój dziadek zdobył te satelity dla korporacji. Uratowalibyśmy wiele istnień ludzkich, gdyby udało nam się wynieść je na orbitę. Utrata ich obu to niepowetowana strata.",Meu avô recuperou aqueles satélites para a Arquivo Ltda. Muitas vidas seriam salvas se conseguíssemos enviá-los de volta à órbita. É uma tragédia ter perdido ambos.,"Еще мой дед раздобыл эти спутники для «Архивов». Если бы смогли вернуть их на орбиту, это спасло бы множество жизней... Жаль, но мы все потеряли.",Mi abuelo recuperó esos satélites para Archivo S.A. y habríamos salvado muchas vidas si hubiésemos vuelto a ponerlos en órbita. Es una tragedia haber perdido ambos.
Mission_Satellite_Partial_CEO_Grass_1,"Would've been better to get both satellites into orbit, but at least one of them is up there and transmitting!",,"Ça aurait été mieux si nous avions réussi à mettre les deux satellites en orbite, mais au moins, un des deux est dans l'espace, et en état de nous transmettre des informations.","Es wäre besser gewesen, beide Satelliten in den Orbit zu schießen, aber wenigstens ist einer oben und überträgt Daten!","둘 다 궤도로 올라갔다면 더 좋겠지만, 적어도 하나는 살아 올라가서 신호를 보내고 있습니다! ","Byłoby najlepiej, gdyby oba satelity trafiły na orbitę, no ale udało nam się z jednym! I już nadaje!","Teria sido melhor ver ambos os satélites em órbita, mas pelo menos um deles está transmitindo lá de cima!","Было бы лучше, если бы оба спутника вышли на орбиту, но по крайней мере один из них уже начал передавать данные!","Habría sido mejor poner ambos satélites en órbita, pero, ¡al menos, uno está en posición y transmitiendo!"
Mission_Satellite_Partial_CEO_Grass_2,"I suspect Old Earth scientists wouldn't have been happy with a 50 percent success rate, but it's the best we amateurs can hope for!",,"J'imagine que les chercheurs de la Terre d'antan auraient été déçus par un taux de succès de 50 %, mais il nous était difficile de faire mieux, j'en ai peur...","Ich vermute, dass die Wissenschaftler der Alten Welt mit einer Erfolgsrate von 50% nicht zufrieden wären, aber für uns Amateure war das gut!","구 지구 과학자들이 50퍼센트의 성공율로는 만족하지 않았겠지만, 적어도 우리 아마추어들은 할 수 있는 최선을 다 했습니다. ","Podejrzewam, że naukowców Dawnej Ziemi nie zadowoliłby współczynnik powodzenia rzędu 50%, ale to maksimum, na jakie stać nas – amatorów!","Suspeito que cientistas da Terra Antiga não se contentariam com uma taxa de sucesso de 50%, mas é o melhor que amadores como nós poderíamos esperar!","Я подозреваю, что ученые Старой Земли были бы недовольны 50% успеха, но для нас, любителей, это превосходный результат!","Sospecho que los científicos de la Vieja Tierra no quedarían satisfechos con un porcentaje de éxito del 50%, pero ¡no está mal para unos aficionados!"
Mission_Artillery_Briefing_CEO_Grass_1,Our technicians recently got an Old Earth artillery battery up and running! Please make sure it survives this fight.,,"Nos techniciens ont récemment récupéré une batterie d'artillerie de la Terre d'antan, qu'ils ont remise en marche ! J'espère qu'elle survivra à cette bataille.","Unsere Techniker haben vor Kurzem eine Artilleriebatterie der Alten Welt zum Laufen gebracht. Bitte sorgen Sie dafür, dass sie den Kampf übersteht.",최근 우리 기술자들이 구 지구 포대를 복원해 작동하고 있습니다. 전투에서 살아 남도록 해주세요. ,"Nasi mechanicy uruchomili tu niedawno jednostkę artyleryjską Dawnej Ziemi! Upewnij się, że przetrwa tę bitwę.","Nossos técnicos recentemente reativaram uma bateria de artilharia da Terra Antiga! Por favor, certifique-se de que ela sobreviva a essa luta.","Наши техники недавно ввели в строй артиллерийскую батарею Старой Земли! Пожалуйста, обеспечьте ее сохранность.",¡Nuestros técnicos acaban de hacer operativa una batería artillera de la Vieja Tierra! Aseguraos de que sobreviva a la batalla.
Mission_Artillery_Success_CEO_Grass_1,"Excellent job, we'll leave the artillery battery manned and ready in case the Vek decide to return!",,"Excellent travail ! Nous allons laisser des hommes s'occuper de la batterie d'artillerie, des fois que les Veks reviennent.","Ausgezeichnete Arbeit, wir lassen die Artilleriebatterie bemannt und einsatzbereit, falls die Vek zurückkehren!","잘했습니다, Vek이 돌아올 때를 대비해 포대에 사람을 배치해야겠습니다! ",Doskonała robota! Bateria artyleryjska jest już obsadzona i gotowa na ewentualny powrót veków!,"Ótimo trabalho, deixaremos a bateria de artilharia em prontidão para caso os Vek resolvam voltar!","Превосходная работа. Артиллерия останется на боевом дежурстве на случай, если векки решат вернуться.",Muy buen trabajo. Hemos dejado una dotación en la batería artillera por si a los vek les da por volver.
Mission_Artillery_Failure_CEO_Grass_1,We were hoping to study that artillery battery to expand our military capabilities. Now it's just another worthless pile of scrap.,,"Nous espérions étudier cette batterie d'artillerie pour augmenter nos capacités militaires. Mais ce n'est plus qu'un tas de ferraille, désormais.","Eigentlich wollten wir diese Artilleriebatterie untersuchen, um unsere militärischen Fähigkeiten zu verbessern. Aber jetzt ist sie nur noch Schrott.",그 포대를 연구해서 군사력을 증강시킬 것을 기대했었습니다. 이제 그냥 쓸모없는 고철더미가 되었군요. ,"Mieliśmy nadzieję przyjrzeć się działaniu tej baterii artyleryjskiej, aby zwiększyć nasz potencjał wojskowy. Ale teraz pozostały z niej bezwartościowe, dymiące szczątki.",Tínhamos esperanças de estudar aquela bateria de artilharia para expandir nossas capacidades militares. Agora é só mais um monte de entulho.,Мы надеялись изучить орудия для будущего расширения собственных возможностей. Теперь это просто бесполезная груда металлолома.,"Esperábamos poder estudiar la batería artillera para expandir nuestra capacidad militar, pero ya no es más que un montón de chatarra inútil."
Mission_Mines_Briefing_CEO_Grass_1,"Old Earth produced massive quantities of explosives. This region is littered with uncleared ordnance, so watch your step!",,"La Terre d'antan produisait d'incroyables quantités d'explosifs. Il y en a plein partout dans la région, alors, attention où vous mettez les pieds !","Die Alte Welt hat unzählige Sprengstoffe entwickelt. Diese Region ist mit Sprengmitteln übersät, achten Sie also darauf, wo sie hintreten!","구 지구는 많은 양의 폭발물을 만들었습니다. 이 지역에 해체되지 않은 군수품이 많으니, 발 밑을 조심하세요! ","Dawna Ziemia wyprodukowała olbrzymie ilości materiałów wybuchowych. Ten region jest pełen nierozbrojonych ładunków, więc uważajcie podczas przemieszczania!",Uma quantidade massiva de explosivos era produzida pela Terra Antiga. Essa região está cheia de explosivos não detonados; cuidado onde pisam!,Старая Земля произвела на свет колоссальное количество взрывчатых веществ. Будьте осторожнее: регион плотно заминирован.,"En la Vieja Tierra, se producían ingentes cantidades de explosivos. Esta región está sembrada de munición sin detonar, ¡así que cuidado!"
Mission_Mines_Briefing_CEO_Grass_2,"Old Earth proximity mines are buried in this region from hundreds of years ago. We were slowly disarming them - but then we thought, why not use them against the Vek?",,"Jadis, des mines de proximité de la Terre d'antan ont été enterrées dans la région. Nous les désarmons peu à peu, mais après tout, pourquoi ne pas les utiliser contre les Veks ?","In dieser Region sind Annäherungsminen der Alten Welt seit Hunderten von Jahren vergraben. Wir haben erst nach und nach entschärft ... und dann haben wir uns überlegt, dass wir sie gegen die Vek nutzen könnten.","몇 백년 전에 구 지구 지뢰가 매설되었습니다. 천천히 그 것들을 해체하고는 있습니다만 - 다시 생각해서, Vek을 막는데 쓰면 되겠군요! ","W tym regionie znajduje się wiele zakopanych min zbliżeniowych Dawnej Ziemi sprzed setek lat. Stopniowo je rozbrajaliśmy, ale potem stwierdziliśmy, że mogą się przydać przeciwko vekom.","Há minas de proximidade centenárias da Terra Antiga enterradas nessa região. Estávamos há um tempo desarmando-as, mas então pensamos: por que não usá-las contra os Vek?","В этом регионе уже сотни лет под землей скрываются контактные мины. Мы обезвреживаем их, как можем, но почему бы не использовать их против векков?","En esta región, hay minas de proximidad de la Vieja Tierra enterradas hace siglos. Íbamos desactivándolas poco a poco, pero luego decidimos usarlas contra los vek."
Mission_Mines_Briefing_CEO_Grass_3,We were conducting excavations in this region when the Vek came using Old Earth proximity mines. You may be able to use them against the Vek!,,Nous étions en train d'effectuer des fouilles dans la région avec des mines de proximité de la Terre d'antan quand les Veks sont arrivés. Si vous vous serviez des mines contre eux ?,"Wir haben in dieser Region Grabungen mithilfe von Annäherungsminen der Alten Welt durchgeführt, als die Vek auftauchten. Vielleicht können wir sie gegen die Vek nutzen!",Vek이 왔을 때 구 지구 지뢰를 사용할 수 있도록 발굴을 진행하고 있었습니다. Vek을 상대하는 데 써먹을 수 있을 겁니다! ,"Kiedy nadeszły veki, prowadziliśmy wykopaliska w tym regionie z użyciem min zbliżeniowych Dawnej Ziemi. Możesz je wykorzystać przeciwko robalom!","Quando os Vek vieram, escavações estavam sendo conduzidas nessa região usando minas de proximidade da Terra Antiga. Talvez você possa usá-las contra os Vek!","Когда в регион заявились векки, мы вели раскопки с помощью контактных мин Старой Земли. Возможно, вам удастся применить их против врага!","Cuando llegaron los vek, estábamos llevando a cabo excavaciones en la región con minas de proximidad de la Vieja Tierra. ¡Intentad usarlas contra ellos!"
Mission_Mines_Success_CEO_Grass_1,"Watching those mines take out the Vek was a real treat! And with fewer mines around, it's safer for our forces to move through the region.",,"Voir ces mines détruire les Veks était vraiment super ! Et maintenant qu'il reste moins de mines dans la région, nos déplacements de troupes seront moins risqués.","Zu sehen, wie die Minen die Vek ausgelöscht haben, war wunderbar! Mit weniger Minen im Boden können sich unsere Kräfte dort sicherer bewegen.","지뢰를 조심하면서 Vek을 상대하는 건 정말 힘든 일이었습니다! 이제 지뢰가 적어졌기에, 우리 군을 이 지역으로 배치할 수 있겠군요. ","Przyglądanie się, jak te miny szatkują veki było istną ucztą dla oczu! Co więcej, mniejsza liczba min w tym regionie czyni go bezpieczniejszym dla przemarszu naszych oddziałów.","Ver aquelas minas arrasando com os Vek foi um show e tanto! E com menos minas ativas, a movimentação de nossas tropas pela região ficou mais segura.","Просто загляденье, как мины разбираются с векками. А после такого «разминирования» нашим силам будет проще действовать в регионе.","¡Qué gozada ver cómo las minas se cargaban a los vek! Y, además, nuestras fuerzas pueden moverse por la región con más seguridad ahora que hay menos minas."
Mission_Mines_Success_CEO_Grass_2,"With the Vek gone, and some proximity mines cleared, we can establish a permanent military presence in the region!",,"Maintenant que les Veks ont été vaincus et qu'il y a moins de mines de proximité, nous allons pouvoir établir une présence militaire permanente dans la région !","Die Vek sind fort und ein Teil der Annäherungsminen ist geräumt, sodass in der Region eine dauerhafte militärische Präsenz möglich ist!","Vek들이 사라졌고, 지뢰들이 좀 없어졌기에, 주둔군을 이 지역에 배정할 수 있겠군요! ","Veki odeszły, a część min została zlikwidowana. Możemy dzięki temu na stałe rozmieścić w tym regionie nasze wojska!","Com o fim dos Vek, e algumas minas de proximidade a menos, podemos estabelecer uma presença militar permanente na região!","Векков нет, мины частично нейтрализованы, а мы можем привести в регион постоянный контингент!","Ahora que se han ido los vek y se han desactivado unas cuantas minas de proximidad, podemos establecer una presencia militar permanente en la región."
Mission_Dam_Briefing_CEO_Grass_1,Destruction of the dam in this region is a necessary evil - it will create a natural barrier between us and the burrowing Vek.,,La destruction du barrage est un mal nécessaire. Cela créera une barrière naturelle entre nous et les Veks.,"Die Zerstörung des Damms in dieser Region ist notwendig, denn er schafft eine natürliche Barriere zwischen uns und den eingegrabenen Vek.",댐의 철거는 필요 악입니다 - 숨어있는 Vek과 우리 사이에 자연 장벽을 만들어 줄 겁니다. ,Zniszczenie tamy w tym regionie było mniejszym złem. Stworzyliśmy w ten sposób naturalną przeszkodę między nami a ryjącymi w ziemi vekami.,Destruir a represa dessa região é um mal necessário. Isso criará uma barreira natural entre nós e os Vek escavadores.,Плотину необходимо уничтожить. Она создаст естественную преграду между нами и продвижением векков.,"Destruir la presa es un mal necesario, ya que se creará una barrera natural entre los vek subterráneos y nosotros."
Mission_Dam_Briefing_CEO_Grass_2,"This Old Earth dam used to generate power, but has little use now. Destroying it will let the river reclaim the land and delay the Vek.",,"Ce barrage de la Terre d'antan servait à générer de l'électricité, mais aujourd'hui, il ne sert plus à rien. Détruisez-le pour que l'eau envahisse la région, cela retardera les Veks.","Mit dem Damm der Alten Welt wurde Energie erzeugt, doch jetzt wird er kaum noch genutzt. Wenn wir ihn zerstören, holt sich der Fluss das Land zurück und hält die Vek auf.","이 구 지구 댐은 발전하는데 사용했었지만, 지금은 별로 사용하지 않습니다. 이 것을 철거해 강이 다시 흐르게 해 Vek을 지연시킬 것입니다. ","Ta tama Dawnej Ziemi wytwarzała prąd, ale teraz niewiele z niej pożytku. Jej zniszczenie pozwoli zalać pobliskie tereny i spowolnić postępy veków.","Essa represa da Terra Antiga costumava gerar energia, mas tem pouca utilidade agora. Destruí-la permitirá que o rio retome seu curso e atrase os Vek.","Когда-то плотина обеспечивала Старую Землю электроэнергией, но для нас она бесполезна. А вот ее уничтожение позволит реке задержать векков.","Esta presa de la Vieja Tierra se empleaba para generar electricidad, pero ahora sirve de poco. Si se destruye, el río volverá a su cauce y la inundación retrasará a los vek."
Mission_Dam_Success_CEO_Grass_1,It was painful to watch that historic monument fall. I hope it was worth the sacrifice.,,C'était terrible de voir ce monument historique détruit. J'espère que le sacrifice en valait la peine.,"Es war schlimm, die Zerstörung dieses historischen Monuments zu sehen. Hoffentlich hat sich das Opfer gelohnt.","이 역사적 건축물이 없어지는 걸 보는 것은 고통스럽지만, 희생이 그럴 가치가 있길 빕니다. ","Z bólem patrzyłem, jak wali się ten historyczny pomnik minionej cywilizacji. Oby wyszło to nam na dobre.",Foi doloroso assistir àquele monumento histórico partir. Espero que o sacrifício tenha valido.,"Больно смотреть на разрушение исторического памятника. Надеюсь, эта жертва того стоила.",Me duele en el alma ver desaparecer ese monumento histórico. Espero que el sacrificio merezca la pena.
Mission_Dam_Success_CEO_Grass_2,"Thank you, #squad - the destruction of that dam will delay the Vek while we try to get more military technology back online!",,Merci aux #squad ! La destruction de ce barrage retardera les Veks pendant que nous essayons de remettre d'autres armes de la Terre d'antan en état de marche.,"Danke, #squad! Die Zerstörung des Damms wird die Vek etwas aufhalten, während wir versuchen, mehr Militärtechnologie zum Laufen zu bringen!","#squad, 감사합니다 - 댐의 철거가 더 많은 군사 기술들을 살리는 동안 Vek을 지연시켜 줄겁니다! ","Dziękuję, #squad! Zniszczenie tej tamy opóźni veki i pozwoli nam uruchomić więcej maszyn wojennych!","Obrigado, #squad, destruir aquela represa irá atrasar os Vek enquanto tentamos reativar mais tecnologias militares!","Спасибо, #squad. Уничтожение дамбы задержит векков, а мы пока попытаемся ввести в строй новые военные технологии.","Gracias, #squad. La destrucción de la presa retrasará a los vek mientras intentamos volver a poner en funcionamiento más tecnología militar."
Mission_Dam_Success_CEO_Grass_3,"Now there's a massive river between the refugees and the Vek hives, we all should be a lot safer! Thank you, #squad.",,"Maintenant qu'il y a une énorme rivière entre les réfugiés et les ruches veks, nous devrions être plus en sécurité. Merci à vous et aux #squad.","Jetzt befindet sich ein riesiger Fluss zwischen den Flüchtlingen und den Vek-Nestern, alles müsste sicherer sein! Vielen Dank, #squad.","피난민과 Vek 소굴 사이에 큰 강이 생겼습니다, 더 안전해지겠죠! #squad, 감사합니다. ","Teraz pomiędzy uchodźcami i ulami veków płynie szeroka rzeka! Powinniśmy być o wiele bezpieczniejsi. Dziękuję, #squad.","Agora que há um rio imenso entre os refugiados e as colônias Vek, vamos ficar muito mais seguros! Obrigado, #squad.","Теперь между ульями векков и беженцами огромная река. Так гораздо безопаснее! Спасибо вам, #squad.","Ahora que hay un río enorme entre los refugiados y las colmenas vek, estaremos muchísimo más seguros. Gracias, #squad."
Mission_Dam_Failure_CEO_Grass_1,The destruction of that dam would have been useful. At least it's still impressive to look at.,,"La destruction de ce barrage aurait pu être utile. Mais au moins, il est toujours aussi impressionnant.",Die Zerstörung des Damms wäre nützlich gewesen. Wenigstens ist sein Anblick nach wie vor beeindruckend.,댐의 철거가 유용했을 것입니다. 적어도 보기에는 장엄하군요. ,Zniszczenie tej tamy bardzo by nam pomogło. No ale przynajmniej możemy nadal podziwiać jej imponującą konstrukcję.,A destruição daquela represa teria sua utilidade. Pelo menos ainda é uma vista impressionante.,"Разрушение плотины было бы крайне уместно, но, по крайней мере, она продолжает радовать глаз.","Habría sido útil destruir la presa. Al menos, da gloria verla intacta."
Mission_Dam_Failure_CEO_Grass_2,"With the river still locked behind the dam, the refugee centers in the adjoining region are easy targets for burrowing Vek.",,"Vu que le barrage est toujours debout, les centres de réfugiés sont des cibles faciles pour les Veks.","Da der Fluss nach wie vor hinter dem Damm eingesperrt ist, sind die Flüchtlingszentren in der angrenzenden Region leichte Ziele für grabende Vek.","강물이 아직 댐에 갇혀있기에, 지역에 인접한 피난민 센터가 숨어있는 Vek에게 쉬운 목표가 되겠군요. ","Nie udało nam się utworzyć rzeki z zasobów zbiornika wodnego tamy. Oznacza to, że uchodźcy w pobliskich regionach są teraz łatwym celem dla veków.","Com o rio ainda bloqueado pela represa, os centros de refugiados na região adjacente são alvos fáceis para os Vek escavadores.","Поскольку плотина все еще сдерживает реку, лагеря беженцев в соседнем регионе могут стать легкой добычей для векков.","Como el río sigue represado, los centros de refugiados de la región colindante son blancos fáciles para los vek subterráneos."
Mission_Tides_Briefing_CEO_Grass_1,An offshore volcano is causing tidal waves along the coast - and may help wash away the Vek threatening the area.,,Un volcan sous-marin cause des raz-de-marée le long de la côte. Il pourrait nous aider à nous débarrasser des Veks dans la région.,"Ein Vulkan vor der Küste sorgt für Flutwellen und könnte helfen, die Vek wegzuspülen, die das Gebiet bedrohen.",해저 화산이 해변을 따라 지진해일을 만들고 있습니다 - 지역을 위협하는 Vek을 씻어내리는데 도움이 될 지 모르죠. ,Podmorski wulkan wywołuje wysokie fale wzdłuż całego wybrzeża. Mogą one nam pomóc wymyć veki zagrażające temu obszarowi.,"Um vulcão em alto mar está causando tsunamis por toda a costa, e pode nos ajudar a lavar a ameaça Vek na região.",Извержение вулкана в океане вызвало мощную приливную волну по всему побережью — она может помочь нам решить вопрос с векками в этом регионе.,Un volcán marino está provocando maremotos por toda la costa... A ver si se llevan por delante a unos cuantos vek que amenazan la zona.
Mission_Tides_Success_CEO_Grass_1,"Mother nature comes to our defense! Good thing the structures in the area were prepared for flooding. Thank you, #squad!",,La nature elle-même vient à notre secours ! Heureusement que les structures de la région ont été construites en pensant aux raz-de-marée. Merci aux #squad !,"Mutter Natur eilt zu unserer Verteidigung! Glücklicherweise sind die Bauwerke in der Umgebung für Überflutungen ausgelegt. Vielen Dank, #squad!","대자연의 힘이 우리를 도와주는군요! 이 지역의 건물들이 침수에 대비되어 있었습니다. #squad, 고마워요! ","Matka natura przybyła z odsieczą! Dobrze, że budowle w tym regionie były przygotowane na podtopienia. Dziękuję, #squad!","A mãe natureza vem em nossa defesa! Ainda bem que as estruturas da região eram preparadas contra enchentes. Obrigado, #squad!","Силы природы спешат нам на помощь! Как удачно, что этот регион был заранее подготовлен к наводнению. И спасибо вам, #squad!","¡La Madre Naturaleza acude en nuestra defensa! Menos mal que las estructuras de la zona estaban preparadas para las inundaciones. ¡Gracias, #squad!"
